{
	"$schema": "https://raw.githubusercontent.com/bastani-inc/atomic/main/packages/coding-agent/schemas/theme.schema.json",
	"name": "catppuccin-macchiato",
	"vars": {
		"bg": "#24273a",
		"fg": "#cad3f5",
		"rosewater": "#f4dbd6",
		"flamingo": "#f0c6c6",
		"pink": "#f5bde6",
		"mauve": "#c6a0f6",
		"red": "#ed8796",
		"maroon": "#ee99a0",
		"peach": "#f5a97f",
		"yellow": "#eed49f",
		"green": "#a6da95",
		"teal": "#8bd5ca",
		"sky": "#91d7e3",
		"sapphire": "#7dc4e4",
		"blue": "#8aadf4",
		"lavender": "#b7bdf8",
		"subtext_1": "#a5adcb",
		"subtext_0": "#b8c0e0",
		"overlay_2": "#939ab7",
		"overlay_1": "#8087a2",
		"overlay_0": "#6e738d",
		"surface_2": "#5b6078",
		"surface_1": "#494d64",
		"surface_0": "#363a4f",
		"mantle": "#1e2030",
		"crust": "#181926"
	},
	"colors": {
		"accent": "mauve",
		"border": "surface_1",
		"borderAccent": "lavender",
		"borderMuted": "overlay_0",
		"success": "green",
		"error": "red",
		"warning": "yellow",
		"muted": "subtext_0",
		"dim": "overlay_1",
		"text": "fg",
		"thinkingText": "subtext_0",
		"selectedBg": "surface_1",
		"scrollbarThumb": "surface_1",
		"userMessageBg": "surface_0",
		"userMessageText": "fg",
		"customMessageBg": "surface_0",
		"customMessageText": "fg",
		"customMessageLabel": "mauve",
		"toolPendingBg": "surface_0",
		"toolSuccessBg": "#455451",
		"toolErrorBg": "#563f51",
		"toolTitle": "lavender",
		"toolOutput": "fg",
		"mdHeading": "mauve",
		"mdLink": "blue",
		"mdLinkUrl": "overlay_1",
		"mdCode": "rosewater",
		"mdCodeBlock": "fg",
		"mdCodeBlockBorder": "surface_1",
		"mdQuote": "subtext_1",
		"mdQuoteBorder": "overlay_0",
		"mdHr": "surface_2",
		"mdListBullet": "mauve",
		"toolDiffAdded": "green",
		"toolDiffRemoved": "red",
		"toolDiffContext": "overlay_1",
		"syntaxComment": "overlay_2",
		"syntaxKeyword": "mauve",
		"syntaxFunction": "blue",
		"syntaxVariable": "fg",
		"syntaxString": "green",
		"syntaxNumber": "peach",
		"syntaxType": "yellow",
		"syntaxOperator": "sky",
		"syntaxPunctuation": "overlay_2",
		"thinkingOff": "overlay_0",
		"thinkingMinimal": "surface_2",
		"thinkingLow": "sapphire",
		"thinkingMedium": "blue",
		"thinkingHigh": "mauve",
		"thinkingXhigh": "pink",
		"bashMode": "green"
	},
	"export": {
		"pageBg": "bg",
		"cardBg": "surface_0",
		"infoBg": "mantle"
	}
}
