{
	"$schema": "https://raw.githubusercontent.com/bastani-inc/atomic/main/packages/coding-agent/schemas/theme.schema.json",
	"name": "catppuccin-frappe",
	"vars": {
		"bg": "#303446",
		"fg": "#c6d0f5",
		"rosewater": "#f2d5cf",
		"flamingo": "#eebebe",
		"pink": "#f4b8e4",
		"mauve": "#ca9ee6",
		"red": "#e78284",
		"maroon": "#ea999c",
		"peach": "#ef9f76",
		"yellow": "#e5c890",
		"green": "#a6d189",
		"teal": "#81c8be",
		"sky": "#99d1db",
		"sapphire": "#85c1dc",
		"blue": "#8caaee",
		"lavender": "#babbf1",
		"subtext_1": "#a5adce",
		"subtext_0": "#b5bfe2",
		"overlay_2": "#949cbb",
		"overlay_1": "#838ba7",
		"overlay_0": "#737994",
		"surface_2": "#626880",
		"surface_1": "#51576d",
		"surface_0": "#414559",
		"mantle": "#292c3c",
		"crust": "#232634"
	},
	"colors": {
		"accent": "mauve",
		"border": "surface_1",
		"borderAccent": "lavender",
		"borderMuted": "overlay_0",
		"success": "green",
		"error": "red",
		"warning": "yellow",
		"muted": "subtext_0",
		"dim": "overlay_1",
		"text": "fg",
		"thinkingText": "subtext_0",
		"selectedBg": "surface_1",
		"scrollbarThumb": "surface_1",
		"userMessageBg": "surface_0",
		"userMessageText": "fg",
		"customMessageBg": "surface_0",
		"customMessageText": "fg",
		"customMessageLabel": "mauve",
		"toolPendingBg": "surface_0",
		"toolSuccessBg": "#4e5b57",
		"toolErrorBg": "#5e4856",
		"toolTitle": "lavender",
		"toolOutput": "fg",
		"mdHeading": "mauve",
		"mdLink": "blue",
		"mdLinkUrl": "overlay_1",
		"mdCode": "rosewater",
		"mdCodeBlock": "fg",
		"mdCodeBlockBorder": "surface_1",
		"mdQuote": "subtext_1",
		"mdQuoteBorder": "overlay_0",
		"mdHr": "surface_2",
		"mdListBullet": "mauve",
		"toolDiffAdded": "green",
		"toolDiffRemoved": "red",
		"toolDiffContext": "overlay_1",
		"syntaxComment": "overlay_2",
		"syntaxKeyword": "mauve",
		"syntaxFunction": "blue",
		"syntaxVariable": "fg",
		"syntaxString": "green",
		"syntaxNumber": "peach",
		"syntaxType": "yellow",
		"syntaxOperator": "sky",
		"syntaxPunctuation": "overlay_2",
		"thinkingOff": "overlay_0",
		"thinkingMinimal": "surface_2",
		"thinkingLow": "sapphire",
		"thinkingMedium": "blue",
		"thinkingHigh": "mauve",
		"thinkingXhigh": "pink",
		"bashMode": "green"
	},
	"export": {
		"pageBg": "bg",
		"cardBg": "surface_0",
		"infoBg": "mantle"
	}
}
